{
  "id": "file.write",
  "version": "0.1.0",
  "name": "写入文件",
  "description": "把一段文字保存成本机上的文本文件（UTF-8 编码），输出实际保存的完整路径。只能保存为 .txt .md .csv .json .log .html 这几种扩展名。相对路径保存在工作流项目的 outputs 文件夹里，例如写 总结.txt 就存到 outputs\\总结.txt；文件夹不存在会自动创建。文件已存在时按 if_exists 处理：error 报错不覆盖（默认）、overwrite 覆盖、append 加在末尾。会改动你电脑上的文件，所以每次运行前都要你确认；生成时的运行检查只演练、不真的写。不能定时运行，也不能发送到别处。",
  "category": "输出",
  "side_effects": "write",
  "inputs": {
    "text":      { "label": "内容", "type": "string", "required": true,  "description": "要保存的文字" },
    "path":      { "label": "保存到", "type": "string", "required": true,  "description": "保存到哪里，例如 总结.txt 或 E:\\资料\\总结.md" },
    "if_exists": { "label": "已存在时", "type": "string", "required": false, "default": "error", "description": "文件已存在时：error 报错、overwrite 覆盖、append 追加" }
  },
  "outputs": {
    "path":  { "label": "保存位置", "type": "string",  "description": "实际保存的完整路径" },
    "chars": { "label": "写入字数", "type": "integer", "description": "这次写入的字数" }
  },
  "errors": [
    { "code": "exists",           "when": "文件已存在且 if_exists 为 error" },
    { "code": "invalid_option",   "when": "if_exists 不是 error、overwrite、append 之一" },
    { "code": "unsupported_type", "when": "扩展名不是 .txt .md .csv .json .log .html" },
    { "code": "write_failed",     "when": "没有权限、路径是文件夹等原因写不进去" }
  ],
  "examples": [
    { "title": "保存总结", "input": { "text": "这是一个用于示例的网页。", "path": "总结.txt" },
      "output": { "path": "E:\\工作流\\outputs\\总结.txt", "chars": 12 } }
  ],
  "runtime": { "entry": "module.py:run", "timeout_s": 30, "dry_run": "module.py:dry_run" }
}
